tmdb_id,title,original_title,release_date,origin_country,language,genres,keywords,runtime,short_summary,tagline,status,budget,revenue,production_companies,production_countries,poster_url,backdrop_url,homepage,trailer_url,imdb_id,wikidata_id,instagram_id,instagram_url,twitter_id,twitter_url,facebook_id,facebook_url,popularity,vote_average,vote_count
776659,Brother's Keeper,Okul Tıraşı,2021-08-20,TR,tr,Drama,"tragedy, teacher student relationship, boys' school, sickness, remote town, authoritarian",85,"Yusuf and his best friend Memo are pupils at a boarding school for Kurdish boys, secluded in the mountains of Eastern Anatolia. When Memo falls mysteriously ill, Yusuf is forced to struggle through the bureaucratic obstacles put up by the school's repressive authorities to try to help his friend. But by the time the adults in charge finally understand the seriousness of Memo's condition and try to get him to the hospital, the school has been buried under a sudden, heavy snowfall. With no way out",,Released,,,"Asteros Film, Flama Booking","Romania, Turkey",https://image.tmdb.org/t/p/w500/yTqV0pzQkbpTs8olGghxOy3gwUX.jpg,https://image.tmdb.org/t/p/original/kIsyRhnS3v88Z29Vg5gpdjR9XDn.jpg,https://www.alteredinnocence.net/brotherskeeper,https://www.youtube.com/watch?v=xqTooDAQRgc,tt10311018,Q105505653,,,,,,,1.03,7.2,53
1315706,Sijjin 8,Siccīn 8,2025-06-05,TR,tr,Horror,"sequel, supernatural horror",104,"Fatih, who lives with his family in his mother Gönül's house, cannot stand the pressure of his wife Berna and puts his beloved mother in a nursing home. However, the silence that descends on the house after this decision is a harbinger of an approaching storm rather than peace. The house is no longer under their control; a dark force has insidiously surrounded every corner. As the paranormal events become increasingly frightening, Fatih's guilty conscience weighs heavily on his shoulders. Finall",Shutting your eyes won’t save you!,Released,,2700000,Muhteşem Film,Turkey,https://image.tmdb.org/t/p/w500/huSTHhweTkObQvHi85ebSsaAwwR.jpg,https://image.tmdb.org/t/p/original/tpdpdQtRueqrYjT8JgOWbGUFVzQ.jpg,https://www.cinedex.net/en/movie/siccin-8,https://www.youtube.com/watch?v=XBUZZGtlYoM,tt36826841,,,,,,,,0.88,4.0,3
946726,In Good Hands,Sen Yaşamaya Bak,2022-03-21,TR,tr,"Drama, Comedy, Romance",,104,"Diagnosed with a terminal illness, a single mother encounters a suave bachelor as she grapples with the future of her headstrong six-year-old.",,Released,,,TAFF Pictures,Turkey,https://image.tmdb.org/t/p/w500/eymTgzHgYretvL5mT7pwznX4p34.jpg,https://image.tmdb.org/t/p/original/mbxPR3VtGXIRIX5jEUfulJd9A0J.jpg,,,tt14898794,Q111327629,,,,,,,0.82,6.6,154
1237081,Hatıran Yeter,Hatıran Yeter,2024-02-16,TR,tr,"Drama, Romance",,138,"Baha's life, who had a much more difficult and lonely childhood than his peers, because he lost his hearing as a result of meningitis when he was a baby, changes when he meets Leyla, who is deaf and mute like him. However, there will be great obstacles in the way of their happiness, and Baha will have to go through great struggles.",,Released,,800000,Berton Medya,Turkey,https://image.tmdb.org/t/p/w500/wFBszSskJV3pgKBxyAxyZxIun2y.jpg,,,,tt29506334,,,,,,,,1.05,6.8,4
891471,Strike,Grev,2021-10-29,TR,tr,"Drama, History","strike, labor union, silk, working women, ottoman empire, suffragettes",,"In 1910, women working in the silk industry in Bursa, protest against the working conditions. They go on strike.",,Released,,,Kanata Production,Canada,https://image.tmdb.org/t/p/w500/4lBdVyTcWxW7q36A31NEllcSAie.jpg,,,https://www.youtube.com/watch?v=-aqAU9KCWz8,tt15830288,Q117816418,,,,,,,0.81,1.5,4
1425617,Another You,Başka Bir Sen,2025-03-07,TR,tr,"Comedy, Romance",,111,Mümtaz and Derya are condemned to live out their last moments each day in someone else's skin.,,Released,,,,Turkey,https://image.tmdb.org/t/p/w500/vfEbhAzhKavunGOFiOknVtY0NiD.jpg,https://image.tmdb.org/t/p/original/j4oYX4LgNnoRYHnkafGYeyVLULi.jpg,,https://www.youtube.com/watch?v=iZbFfGoeBIk,tt35948720,Q132891519,,,,,,,1.0,6.7,39
1052918,New Year's Eve,Yılbaşı Gecesi,2022-12-30,TR,tr,Comedy,,142,"With the hope that the pandemic is coming to an end, Didem has been preparing for a New Year’s Eve celebration for over a month. All her loved ones can finally get together and make up for the lost time, but the lockdown announcement has her plans blown off course. Ozan is determined to let his wife have the celebration she deserves. He invites their neighbors to the party, and the fun begins.",,Released,,,BKM,Turkey,https://image.tmdb.org/t/p/w500/cWTdKXItojRjozaoCOv4zmBGxzO.jpg,https://image.tmdb.org/t/p/original/9bJ1uPHZnpRV2KGBx2ypnKxTUGE.jpg,,,tt21268790,Q116035959,,,,,,,0.95,5.3,32
972445,CMXXIV,CMXXIV,2025-12-31,TR,tr,Comedy,stand-up comedy,113,Turkish comedy heavyweight Cem Yılmaz takes the stand-up stage in this dynamic special – covering everything from cancel culture to regretful tattoos.,,Released,,,CMYLMZ Fikirsanat,Turkey,https://image.tmdb.org/t/p/w500/zN25h6zhlYLEnrCv1Zv3MWjtLoy.jpg,https://image.tmdb.org/t/p/original/lpkTnBy7EhEufZsVhuRq0w30dsj.jpg,https://www.netflix.com/tr/title/81622696,,tt39214430,,,,,,,,0.8,6.3,19
1555331,D.I.S.C.O.,D.I.S.C.O.,2026-01-01,TR,tr,"Action, Comedy","casino, secret mission, secret organization, secret government organization, agent, buddy comedy, dangerous mission, cyprus, cheerful, cliché, farcical",102,"The operation, which has been carried out in secret by the D.I.S.C.O. intelligence agency for a long time, fails because of Agent Ertan. Ertan, who was suspended from the organization, goes on vacation with his wife Seda. Here, the path crosses with Bandırma Hair Dryer First Zafer and his wife Aynur. Zafer, who learned about Ertan's profession, has only one condition to be silent. To finish Ertan's unfinished operation together. Because the organization that the organization is after is in the s",,Released,,5250000,"MGX Film, BG Film",Turkey,https://image.tmdb.org/t/p/w500/jHXxVDqA130tXf8O20OHLDom4hD.jpg,https://image.tmdb.org/t/p/original/l437c1NjyPl6jL1qZla7WeUlxFi.jpg,,,tt39105882,Q137843369,d.i.s.c.o.filmi,https://www.instagram.com/d.i.s.c.o.filmi/,,,61580155644533,https://www.facebook.com/61580155644533,1.25,7.8,5
1169361,10 Days of a Curious Man,Meraklı Adamın 10 Günü,2024-11-06,TR,tr,"Thriller, Drama, Crime",,110,"When a young woman goes missing in Istanbul, a jaded writer gets tangled up in a deadly chain of events as he sets out to find her—and a good story.",,Released,,,Ay Yapım,Turkey,https://image.tmdb.org/t/p/w500/peUTdwuWWaQ6aBr20GnBn1Sr3Fe.jpg,https://image.tmdb.org/t/p/original/iF9b95STc8hUbcoBon8QQBP5K6o.jpg,https://www.netflix.com/title/81428004,https://www.youtube.com/watch?v=jv57CiZtAEY,tt28713370,Q122462923,,,,,,,0.78,6.0,34
1060456,49,49,2023-01-19,TR,tr,"Drama, Action",,,"Following ISIS's occupation of Mosul in 2014, members of the Turkish National Intelligence Organization (MİT) engaged in a difficult struggle to rescue 49 personnel taken captive at the Turkish Consulate General.",,Released,,,CNP Film,Turkey,https://image.tmdb.org/t/p/w500/nJNbyUFUt3c14CoIjLSn8ZxPw.jpg,https://image.tmdb.org/t/p/original/h6ieVTeCyWjeiOQz7OOVJXB0rr5.jpg,,,tt21741198,,49filmofficial,https://www.instagram.com/49filmofficial/,49filmofficial,https://twitter.com/49filmofficial,,,0.93,7.4,14
1450374,Dolphin Boy 2,پسر دلفینی ۲,2025-05-08,TR,fa,"Animation, Family, Fantasy, Adventure",,91,"The heroic deeds of the dolphin boy made him a legend among the sea creatures and the inhabitants of the island, but despite his fame, he feels lonely, because everyone around him expects only new achievements from him, and he has almost no real friends. In addition, he still does not know the story of his origin, even his real name is a mystery to the boy. The sudden appearance of huge whales and evil crabs in the sea strikes fear into the hearts of the islanders and sea creatures. Fate throws ",,Released,,,"SkyFrame, Vselennaya Kino",Russia,https://image.tmdb.org/t/p/w500/cQC0IPTc3I1gP9CAmJThm3wAQ42.jpg,https://image.tmdb.org/t/p/original/Ag1CRW9rPNoQpcbSBjndQ1yv2lA.jpg,,,,,,,,,,,0.62,5.8,5
952062,Recep Ivedik 7,Recep İvedik 7,2022-12-09,TR,tr,Comedy,"village, absurd, ridiculous",133,"Recep and Nurullah decide to go village house, which is inherited from his grandma. Recep finds out the existence of a big project, that will damage the village and the surrounding forests. Villagers will fight against the project with Recep's leadership.",,Released,,,"Çamaşırhane Film, Aksoy Film Production",Turkey,https://image.tmdb.org/t/p/w500/cTTo0PlRBzupo3zj8EoJXzYnj1i.jpg,https://image.tmdb.org/t/p/original/hOfmfSL2urbiju9E6TcuEgVR2uB.jpg,http://recepivedik.com/,,tt19759204,Q115634487,recepivedik,https://www.instagram.com/recepivedik/,,,recepivedik,https://www.facebook.com/recepivedik,1.18,5.8,66
1537157,Gazelle,Gazelle,2025-10-03,TR,tr,Drama,,103,"Yakup, a Turkish music teacher seeking political asylum in New York, is trying to keep his head above water as he navigates the US immigration system. Working illegally in a restaurant kitchen with a lively group of fellow immigrants, he is laser focused on laying the groundwork to bring his wife and daughter abroad. In a desperate attempt to expedite the process, he seeks help from a group of shady fellow countrymen who resort to risky methods to get people out of Turkey. But things quickly go ",Exile is only the beginning.,Released,1300000,,Roaring Cat Films,United States of America,https://image.tmdb.org/t/p/w500/ngjiT2qJhzFqAsNdVRp1391bVE4.jpg,https://image.tmdb.org/t/p/original/kNCGZEak2LRiqaLOZzq4QYv5sJw.jpg,http://www.gazellefilm.com,https://www.youtube.com/watch?v=NDRPwcGwIOw,tt27797382,,,,,,,,0.69,0.0,0
1036487,Eflatun,Eflâtun,2023-01-23,TR,tr,"Drama, Romance, Animation",,103,"Eflatun, a blind woman since childhood, has been able to get a hold of her life with the help  of her father’s various shadow and sound plays. Eflatun inherits her father’s profession of  clock repair. She waits for a man with who she had fallen in love with his voice. One day a  man whose voice is identical to the man she’s searching for comes into the shop.",,Released,,,"Karakuş Film, Pulse Yapım",Turkey,https://image.tmdb.org/t/p/w500/xExjJp5aU7Sdh81TeGR8fbKxEiv.jpg,https://image.tmdb.org/t/p/original/lxC0TPqCq5FBiUeTfG9Fph2lB5Z.jpg,,,tt13304286,,eflatun.film,https://www.instagram.com/eflatun.film/,,,eflatun.lilac,https://www.facebook.com/eflatun.lilac,0.88,7.7,3
1211808,The Same,Aynı,2022-11-27,TR,tr,"Drama, Romance","mystic, love, uniqueness, romantic",14,"While Ahmet is going to meet his girlfriend on the seaside, he sees her with another man. But actually there are two of the same woman.",,Released,,,Zıvana Film,Turkey,https://image.tmdb.org/t/p/w500/h9ktvoJhR7bAs7v7r1vSOnXgqZA.jpg,https://image.tmdb.org/t/p/original/eksVh7UdzRAUxe1MkSMp5bBOcjD.jpg,,,,,,,,,,,0.72,0.0,0
1074262,10 Days of a Bad Man,Kötü Adamın 10 Günü,2023-08-18,TR,tr,"Crime, Drama",,124,"Battered, broken and bereaved, a private investigator must muscle his way through a tangle of lies to uncover the truth behind a mansion murder.",,Released,,,Ay Yapım,Turkey,https://image.tmdb.org/t/p/w500/fZhPy0pIxAiV3ZHGBsuAvR30Mgb.jpg,https://image.tmdb.org/t/p/original/sil4GzTAvmxFWqsp5FWZcG7adtS.jpg,https://www.netflix.com/title/81428003,https://www.youtube.com/watch?v=C8353oYe5ik,tt24852002,Q118112525,,,,,,,1.16,6.4,117
878971,The Four Walls,Dört Duvar,2021-10-30,TR,tr,Drama,,114,"Kurdish composer Boran is no longer able to see the ocean, obstructed by a new building, and a tragedy befalls him…",,Released,,,"Mad Dogs & Seagulls Ltd, Motiva Film, Mij Film Co.","United Kingdom, Turkey",https://image.tmdb.org/t/p/w500/sNmIgahxQN8Z2LXfiiCb5MBSWtk.jpg,https://image.tmdb.org/t/p/original/shxlDnHfacrTXhXe9HK8MbEpH9Y.jpg,,https://www.youtube.com/watch?v=SNRQsykcVwQ,tt14848306,,,,,,,,0.47,3.5,2
874948,Grudge,Kin,2021-10-08,TR,tr,"Thriller, Drama",policial,104,"Ahead of a promotion, a police chief becomes entangled in a deadly incident and uncovers an intrigue fueled by grudge that threatens his colleagues.",,Released,,,BKM,Turkey,https://image.tmdb.org/t/p/w500/6fhqb5JegWJGMuomR3Jqmo0Skqn.jpg,https://image.tmdb.org/t/p/original/ux6gkGSKNFtp2NFYxwYFxVWdnGa.jpg,https://www.netflix.com/title/81346326,https://www.youtube.com/watch?v=LM2sdqqk5Uo,tt13717980,Q108576420,,,,,,,1.1,6.1,94
1230085,Ashes,Kül,2024-02-09,TR,tr,"Romance, Drama, Fantasy",,100,"From an intoxicating fantasy to a dangerous affair, a wealthy married woman finds her life irreversibly shattered after picking up an unpublished novel.",,Released,,,Ay Yapım,Turkey,https://image.tmdb.org/t/p/w500/9v7e4WvlEY4JnO62OEuw3zllmAP.jpg,https://image.tmdb.org/t/p/original/fTsDaTNpWwbFIm4bVnLVHu9HNsm.jpg,https://www.netflix.com/title/81616617,https://www.youtube.com/watch?v=1dvZwG8_sZY,tt21308718,Q118212691,,,,,,,1.49,5.7,66
1248795,Art of Love,Romantik Hırsız,2024-03-13,TR,tr,"Romance, Action, Drama","absurd, a arte de amar",99,"After learning that the art thief she has been chasing is her ex-lover, an officer working for Interpol concocts a plan to catch him red-handed.",,Released,,,,Turkey,https://image.tmdb.org/t/p/w500/niVtvS9Kf8G1VDPSqurqHkaSSwm.jpg,https://image.tmdb.org/t/p/original/9jRWk8xxPxs1HhyjUcwgh0jtpuI.jpg,https://www.netflix.com/title/81689799,https://www.youtube.com/watch?v=f77agh-CZ-c,tt28355490,Q125543995,,,,,,,1.32,6.4,151
678856,Intoxicated by Love,مست عشق,2024-04-24,TR,tr,"Drama, History, Romance","sufism, story of rumi, seljuk empire, sufi music",118,"Story of Rumi, his friendship with Shams Tabrizi, the love he had for him and the great influence of Shams over him in his life, his poetry and his love for God.",,Released,,,"ENG Yapım Medya, Simarya Film Production, HA International","Iran, Turkey",https://image.tmdb.org/t/p/w500/kFz3NdX7zJoBRlSOEGP2eRea0rD.jpg,https://image.tmdb.org/t/p/original/5nyXTZ1upvFdFmM6LVvHBTqTdr1.jpg,,https://www.youtube.com/watch?v=7eRuzyXz7jM,tt11281220,Q85974844,masteeshghmovie,https://www.instagram.com/masteeshghmovie/,,,,,1.85,7.8,5
1006911,Make Me Believe,Sen İnandır,2023-06-23,TR,tr,"Romance, Comedy",enemies to lovers,104,Two meddling grannies trick their adult grandkids into a meet-cute that reignites a childhood crush and old grudges.,,Released,,,TAFF Pictures,Turkey,https://image.tmdb.org/t/p/w500/q1MWxML2IuAZMLKxxNaZDQTbqU5.jpg,https://image.tmdb.org/t/p/original/mKlBeUZvmHUbo4LObp7OvLVkL2G.jpg,https://www.netflix.com/title/81622697,https://www.youtube.com/watch?v=5Tda-kt97sc,tt21257152,Q120837871,,,,,,,1.58,6.4,128
1054513,Private Lesson,Özel Ders,2022-12-16,TR,tr,"Comedy, Romance",tutor,89,"Posing as a private tutor, Azra secretly coaches students on achieving their goals in life and love — but not without a few bumps in the road.",,Released,,,"OGM Pictures, Organic Films",Turkey,https://image.tmdb.org/t/p/w500/w9KBLiAcV00uMSEsxviI5kRogSs.jpg,https://image.tmdb.org/t/p/original/uZtYhcnk3WWvUzQkJLqnNywMQpb.jpg,https://www.netflix.com/title/81334950,https://www.youtube.com/watch?v=g33zQr0LUHk,tt23782662,Q116051316,,,,,,,1.24,6.7,111
664593,Sisters-In-Law,Eltilerin Savaşı,2020-01-31,TR,tr,Comedy,sister-in-law,118,Two sisters-in-law live as neighbors in the same apartment building with the mother-in-law who promised to give a beautiful sea-view penthouse to the one who delivers the first grandchild. A battle of egos erupts on social media.,,Released,,8613864,Nulook Production,Turkey,https://image.tmdb.org/t/p/w500/u9yDCxsVLUag3WXyB52S5eeAGed.jpg,https://image.tmdb.org/t/p/original/kVKHuO8nSQloDBuZdqZ1mQpuHvo.jpg,,https://www.youtube.com/watch?v=0YwmqXtMeRo,tt11542214,Q82753363,,,,,,,1.33,5.8,54
1234593,Shambhala,༄༅ཤམ་བྷ་ལ།,2024-09-13,TR,bo,Drama,,150,"In a Himalayan polyandrous village in Nepal, newly married and pregnant Pema tries to make the best of her new life. But soon, her first husband Tashi vanishes on the trade route to Lhasa.  Accompanied by her monk de facto husband, Karma, she embarks on a journey into the unforgiving wilderness to find him, evolving into a quest of self discovery and liberation.",,Released,,,"Ape&Bjørn, Shooney Films, Aaru Production","France, Hong Kong, Nepal",https://image.tmdb.org/t/p/w500/vKjZCLhmgGGv4ydpO5w503yZRR3.jpg,https://image.tmdb.org/t/p/original/aZ8HkgNpcFElM5TKMwBySsX90WF.jpg,,https://www.youtube.com/watch?v=N2EXOwDgrIg,tt30804400,Q124334509,,,,,,,1.14,7.8,13
419767,We Put the World to Sleep,We Put the World to Sleep,2025-10-18,TR,en,"Science Fiction, Mystery, Horror, Drama","artificial intelligence (a.i.), psychopath, anti hero, metaphysics, satire, mockumentary, end of the world, apocalypse, psychological thriller, filmmaking, found footage, psychotronic, mumblecore, cinéma vérité, social issues",83,Adrian and Duru get lost in the characters they play in an apocalyptic film and embark on a secret mission to end the world for real. Second entry in Adrian Țofei and Duru Yücel’s spiritual trilogy which includes Be My Cat: A Film for Anne and Pure.,,Released,,,Adrian Țofei,"Romania, Turkey",https://image.tmdb.org/t/p/w500/xkJglp2dKFefP0m0KV3PdOLfpLm.jpg,https://image.tmdb.org/t/p/original/mytZvEYfMf0bvvxXmMJ4t2W5uyj.jpg,https://linktr.ee/WePutTheWorldToSleep,https://www.youtube.com/watch?v=wt2rssuoEfU,tt10069050,,adriantofeiofficial,https://www.instagram.com/adriantofeiofficial/,AdrianTofei,https://twitter.com/AdrianTofei,AdrianTofeiOfficial,https://www.facebook.com/AdrianTofeiOfficial,1.21,0.0,0
1075797,Ketenpere: Dalavere,Ketenpere: Dalavere,2026-01-09,TR,tr,Comedy,,98,"In the sequel, Kalender has fulfilled his biggest dream: founding a film company. His new goal is to team up with Vefa, who trapped him in first film, to retrieve the gold from Feza, a wealthy businessman obsessed with aliens.",,Released,,1050000,Poll Films,Turkey,https://image.tmdb.org/t/p/w500/dznIeiQ34jlQqcWzZnQco46EHf1.jpg,https://image.tmdb.org/t/p/original/y5QZ6vlHAGanKg9J1iZnqiQSvEL.jpg,,https://www.youtube.com/watch?v=0Z2XS172Aw8,tt38974342,,,,,,,,1.22,0.0,0
1630958,The Birth,The Birth,2026-01-16,TR,en,"Horror, Drama, Fantasy","monster, isolation, surrealism, short film, body horror, breakup",4,"Alone in a filth-ridden apartment, a solitary man consumes a steady diet of toxic internet culture and processed waste. When a breakup text triggers a visceral reaction, the line between the consumer and his filth begins to blur.",EAT. SCROLL. ROT.,Released,,,,,https://image.tmdb.org/t/p/w500/lDZqTzulel6Y9ED3rrR6EbiOheI.jpg,,,,,,,,,,,,0.77,0.0,0
1546963,Soyut Dışavurumcu Bir Dostluğun Anatomisi Veyahut Yan Yana,Soyut Dışavurumcu Bir Dostluğun Anatomisi Veyahut Yan Yana,2025-11-14,TR,tr,"Drama, Comedy","male friendship, remake, foreign language adaptation, unlikely friendship, rich guy, paralyzed, poor man, feel good, feel-good comedy",148,"A wealthy man, paralysed after an accident, hires a caregiver from a completely different background. The unlikely relationship between these two opposite characters soon transforms into an extraordinary and powerful friendship that changes both of their lives.",,Released,,15650000,Nulook Production,Turkey,https://image.tmdb.org/t/p/w500/hykA5yq9tHCKR7WENSgavrNdFeS.jpg,https://image.tmdb.org/t/p/original/438YXcPF7bkEjJUEktMn2GocS6Q.jpg,,,tt37529347,Q136915515,,,,,,,1.1,7.4,7
682152,Burning Days,Kurak Günler,2022-12-09,TR,tr,"Drama, Thriller","rape, politics, turkey, love affair, prosecutor, lgbt, gay theme, mayoral election",131,"With the mayoral election approaching, the newly-appointed state prosecutor of a small town suffering from a water supply crisis gradually descends into trouble after a young local woman is raped.",A pig hunt in the middle of town.,Released,,,"Liman Film, Circe Films, Horsefly Productions","Croatia, France, Germany",https://image.tmdb.org/t/p/w500/6GH0Sv9zQwky0GrBQdHGej7kyau.jpg,https://image.tmdb.org/t/p/original/zrDLv2jGlL7mwkRKpw7oXNoCLhE.jpg,,https://www.youtube.com/watch?v=0bWxPgQNp1o,tt14859416,Q111955137,,,,,,,1.33,6.9,128
927855,Love Tactics,Aşk Taktikleri,2022-02-11,TR,tr,"Romance, Comedy",,97,"An ad executive and a fashion designer-blogger don't believe in love, so they place a bet to make the other fall head over heels - with unusual tactics.",,Released,,,Lanistar Media,Turkey,https://image.tmdb.org/t/p/w500/8RyASTsrKKRnQ9xSGJDuImD8cjX.jpg,https://image.tmdb.org/t/p/original/3ZSXRocKLgBL6gM8nBZsbPq9ZUk.jpg,,https://www.youtube.com/watch?v=ExfET5C8dFg,tt14486678,Q110937156,,,,,,,1.0,7.1,326
1155739,3391 Kilometers,3391 Kilometre,2024-01-12,TR,tr,"Romance, Drama","man woman relationship, love, relationship, long distance relationship, young lovers",109,"Would you fall in love with a person whose voice you haven't heard for months, whose face you haven't touched, you can't smell, you don't even have the chance to pass by the same street, you can't even be in the same photo, who is miles away from you, even by seas, islands and cities?",A story of long-distance love.,Released,,3900000,"Böcek Film, OTTO Entertainment",Turkey,https://image.tmdb.org/t/p/w500/wQp5H2QxaTVdyYZhcDMSk4tdAdb.jpg,https://image.tmdb.org/t/p/original/oUsHMyRdKX0RqApHeC0Dt2h07o3.jpg,,,tt28363568,,,,,,,,1.2,6.0,16
1044302,Last Call for Istanbul,İstanbul İçin Son Çağrı,2023-11-24,TR,tr,"Romance, Drama","new york city, chance meeting",91,"A chance meeting at the airport leads two married people to an unforgettable night full of excitement, desire, and temptation in New York City.",,Released,,,"OGM Pictures, PToT Film",Turkey,https://image.tmdb.org/t/p/w500/d4kAmLjAeQmtFPqlZf4x7Bggu8R.jpg,https://image.tmdb.org/t/p/original/wEwE7WtkoQSW7ZmlRI8fRz3C0LQ.jpg,https://www.netflix.com/title/81610272,https://www.youtube.com/watch?v=KlQo-S7TZ3I,tt23334616,,,,,,,,1.06,6.3,137
1073337,10 Days of a Good Man,İyi Adamın 10 Günü,2023-02-10,TR,tr,"Crime, Drama",,124,"A lawyer turned private investigator takes on a missing person case, propelling him on an unexpected and life-altering quest.",,Released,,,Ay Yapım,Turkey,https://image.tmdb.org/t/p/w500/eQnY9isD2u7jdSkyfy8qjdMgQnT.jpg,https://image.tmdb.org/t/p/original/72Cz99QcfnlcyUy7PePQZISVxxr.jpg,https://www.netflix.com/title/81426851,https://www.youtube.com/watch?v=HNlEdUmROyM,tt23334464,Q116997822,,,,,,,1.7,6.5,98
1001270,The Things You Kill,Öldürdüğün Şeyler,2025-04-25,TR,tr,"Thriller, Drama",psychological thriller,115,"Questioning the suspicious death of his mother, a university professor and his enigmatic gardener descend into a hypnotic maze of mirrors and memories. As family secrets surface and painful truths emerge, they spiral toward a devastating reckoning with the darkness lurking within us all.",,Released,,,"Fulgurance, Remora Films, Lava Films","Canada, France, Poland",https://image.tmdb.org/t/p/w500/kR8CHANk8KwQLWarMIQsk2mthhW.jpg,https://image.tmdb.org/t/p/original/81aIon8MEVc22269MqR6tVkt9rx.jpg,,https://www.youtube.com/watch?v=EJDh_VvKhi8,tt32367116,Q131920949,,,,,,,0.96,6.1,15
1250999,The Witch,Cadı,2024-04-26,TR,tr,"Mystery, Thriller, Horror","witch, based on novel or book, widow, hypnosis, bride, false accusations, manor, dark secret, 19th century, ottoman empire, bitter",134,"During the period of the collapse of the Ottoman Empire, a woman who reluctantly went to a gloomy Istanbul mansion as a bride, and the mysterious owner of the mansion, will go on a journey to the dark secrets of the past together.",,Released,,860000,"WOW Studios, A90 Pictures",Turkey,https://image.tmdb.org/t/p/w500/9KeE7l8Lc0ma8ged6DjXaR8Geiz.jpg,https://image.tmdb.org/t/p/original/6YaOMF7lV6U19HSZiAOdCCC1IrM.jpg,,,tt31579702,,,,,,,,0.95,6.6,16
1140191,Saýara,Saýara,2024-06-21,TR,tr,"Action, Thriller, Crime","femme fatale, revenge, angry, somber, desperate, cruel",98,"When her sister is murdered by a group of politically connected rich kids, Sayara, a quiet gym cleaner from Turkmenistan, begins to follow in her father's footsteps, seeking a path of revenge.",,Released,,,"Inter Yapım, Mo Film",Turkey,https://image.tmdb.org/t/p/w500/tFBX605AuHV27IeIzlSLpFgz3IJ.jpg,https://image.tmdb.org/t/p/original/nAFu4JjX0cr1T6HtfWeEUUBdjqY.jpg,,,tt28056072,,,,,,,,0.99,5.7,12
1177911,The Funeral,Cenaze,2024-10-31,TR,tr,"Horror, Thriller","dead body, zombie, hearse",109,"Cemal drives a hearse for a living. He's entrusted with secretly carrying the body of a young girl at the request of her family. One night, he hears strange groans from the back of the truck, even though the girl hasn't got a pulse.",Feed the love.,Released,,,"LucidLab, Solis Film",Turkey,https://image.tmdb.org/t/p/w500/nubOF5PQ01urMs3dDXCF2BqmBuE.jpg,https://image.tmdb.org/t/p/original/bYNwZn7TlX6CEkJIHdbirFHQrjS.jpg,,https://www.youtube.com/watch?v=-csF4ng9s9E,tt23869968,,,,,,,,0.65,7.1,15
776654,Bergen,Bergen,2022-03-04,TR,tr,"Drama, Music",,145,"Bergen, a valuable Turkish arabesque singer, fights to stay afloat despite all the difficulties in her life.",The Woman of Sorrows,Released,,,CJ ENM Turkey,Turkey,https://image.tmdb.org/t/p/w500/mxGDZUBAP5bsEONiiYvMhc4GJS5.jpg,https://image.tmdb.org/t/p/original/oJgGtVqdI6z06TQ4ZFzDS1lgDT9.jpg,,https://www.youtube.com/watch?v=Zk9atuBNEzY,tt12578564,Q111190224,,,,,,,0.63,6.0,44
